claim_id,batch,source_id,claim_type,formal_status,model,mathlib_area,preconditions,formal_statement,label
gg2014-relation-lower-bound-008,B03,galbraith-gebregiyorgis-2014,,formalizable,plain,(unassigned),,"For the random-factor-base prime-field index calculus with practical bound m=4 and factor-base dimension l <= 10, the number of polynomial-system trials is at least about 2^{n-40}; for n > 80 this exceeds the sqrt(#G) generic cost, and each trial costs strictly more than one group operation.","With the practical limit m=4 and factor-base dimension l≤10, the number of polynomial-system trials is at least about 2^(n-40), no better than square-root scale for n above 80, and each trial costs more than a group operation."
cheon-multidivisor-crt-004,B05,cheon-2006,,formalizable,plain,(unassigned),,"Let g have prime order in G and let p-1 = prod_j d_j with the d_j pairwise coprime. If for each j the auxiliary powers associated with d_j are available, then alpha can be reconstructed from its residues modulo the d_j via the Chinese Remainder Theorem.","When auxiliary powers associated with pairwise coprime factors of p-1 are available, Corollary 1 reconstructs alpha by solving smaller components and applying the Chinese remainder theorem."
cheon-optimal-divisor-exponents-008,B05,cheon-2006,,formalizable,plain,(unassigned),,"The Cheon bounds are minimized at d ~ p^{1/2} for the (p-1) case and d ~ p^{1/3} for the (p+1) case, giving best-case complexity exponents about p^{1/4} and p^{1/3} respectively, when auxiliary input for such a divisor d exists.","The paper minimizes its bounds at about d=p^(1/2) for the p-1 case and d=p^(1/3) for the p+1 case, giving best exponents near p^(1/4) and p^(1/3), respectively, when sufficient auxiliary input exists."
cheon-pminus1-theorem-002,B05,cheon-2006,,formalizable,plain,Mathlib.GroupTheory.OrderOfElement / Subgroup,,"Let g have prime order in G, and let d | (p-1). Given g, g^alpha, g^{alpha^d}, the value alpha can be recovered in O(log p * (sqrt((p-1)/d) + sqrt(d))) group operations.","If d divides p-1 and g, g^alpha, and g^(alpha^d) are given in a prime-order group, alpha can be recovered in O(log p*(sqrt((p-1)/d)+sqrt(d))) group operations with the stated memory bound."
cheon-pplus1-theorem-005,B05,cheon-2006,,formalizable,plain,(complexity: needs explicit cost model),,"Let d | (p+1). Given g^{alpha^i} for i over the required range, alpha can be recovered in O(log p * (sqrt((p+1)/d) + d)) group operations.","If d divides p+1 and the sequence g^(alpha^i) through the required range is available, Theorem 2 recovers alpha in O(log p*(sqrt((p+1)/d)+d)) group operations with the stated memory."
ghs-index-complexity-008,B05,ghs-2002,,formalizable,plain,(unassigned),,"For curves of fixed genus g, the factor-base (index-calculus) DLP method runs in O(q^{2+epsilon}); with an optimized factor base the asymptotic cost is O(q^{2g/(g+1)+epsilon}).","For fixed genus g, the cited factor-base method has O(q^(2+epsilon)) behavior, and reducing the factor base yields an optimized asymptotic O(q^(2g/(g+1)+epsilon))."
ghs-theorem1-conditional-complexity-002,B05,ghs-2002,,formalizable,plain,Mathlib.GroupTheory.OrderOfElement / Subgroup,,"For fixed n >= 4 and a curve satisfying the GHS condition, the DLP in the large prime-order subgroup is solved in O(q^{2+epsilon}) time, assuming the kernel of the transfer map is not divisible by that large prime.","For fixed n>=4 and curves satisfying the stated condition, Theorem 1 gives O(q^(2+epsilon)) time in the large prime-order subgroup, assuming the transfer map kernel is not divisible by that large prime."
ghs-transfer-map-dlp-006,B05,ghs-2002,,formalizable,plain,(unassigned),,"If the GHS transfer sends the input points to divisor classes D_1, D_2 not both zero, then the elliptic-curve relation log_P(Q) is mapped to an equivalent discrete-log relation in the divisor class group (Jacobian) of the descended curve.","When the transferred divisor classes D1 and D2 are not both zero, the original elliptic-curve relation can be mapped to an equivalent discrete-log relation in the divisor class group of the descended curve."
mov-generic-extension-degree-obstruction-003,B05,mov-1993,,formalizable,plain,(unassigned),,"In general the MOV reduction is exponential in log(q), because the embedding degree k (the least k with n | q^k - 1) is in general exponentially large in log(q).",The paper explicitly states that the reduction is exponential in log(q) in general because the required extension degree k is exponentially large in general.
mov-group-isomorphism-002,B05,mov-1993,,formalizable,plain,(unassigned),,"Let P have order n and let Q be an n-torsion point such that e_n(P,Q) is a primitive n-th root of unity. Then R |-> e_n(R,Q) is a group isomorphism from <P> onto mu_n, the group of n-th roots of unity.","With Q chosen so that e_n(P,Q) is primitive, the map R -> e_n(R,Q) is a group isomorphism from <P> to the n-th roots of unity."
mov-random-q-success-probability-006,B05,mov-1993,,formalizable,plain,Mathlib.GroupTheory.OrderOfElement / Subgroup,,"For Q chosen uniformly among n-torsion points, Pr[ e_n(P,Q) has order exactly n ] = phi(n)/n, where phi is Euler's totient.","In the randomized construction, the probability that the pairing value has order n is phi(n)/n, so repeated trials are part of the expected-cost analysis."
mov-supersingular-polynomial-reduction-004,B05,mov-1993,,formalizable,plain,(complexity: needs explicit cost model),,"For a supersingular elliptic curve E/F_q, there is a probabilistic polynomial-time reduction from the discrete-log problem in E(F_q) to the discrete-log problem in the multiplicative group of a bounded-degree extension field.","For supersingular elliptic curves, the paper gives a probabilistic polynomial-time reduction from the elliptic-curve logarithm problem to a finite-field logarithm problem."
mov-weil-pairing-target-001,B05,mov-1993,,formalizable,plain,Mathlib.GroupTheory.OrderOfElement / Subgroup,,"For P of order n and a suitable n-torsion point Q in E(F_{q^k}), the Weil pairing e_n maps <P> into mu_n subset of F_{q^k}^*.","For a point P of order n and a suitable n-torsion point Q, the Weil pairing maps the cyclic subgroup generated by P into the subgroup of n-th roots of unity in an extension field."
satoh-anomalous-definition-and-goal-001,B05,satoh-araki-1998,,formalizable,plain,(complexity: needs explicit cost model),,An elliptic curve E/F_p is anomalous iff #E(F_p) = p (equivalently trace of Frobenius a_p = 1). For this class there is a polynomial-time algorithm for the ECDLP.,The paper defines an anomalous elliptic curve over F_p by #E(F_p)=p and announces a polynomial-time discrete-log algorithm for that special class.
satoh-final-polynomial-time-dlp-007,B05,satoh-araki-1998,,formalizable,plain,(complexity: needs explicit cost model),,"For p > 7 and E/F_p anomalous, the discrete logarithm in E(F_p) is computable in O((log p)^3) bit operations.","For p>7, the paper concludes that discrete logarithms in E(F_p) can be solved in O((log p)^3) time when E is anomalous."
satoh-homomorphism-dichotomy-002,B05,satoh-araki-1998,,formalizable,plain,(unassigned),,"For an anomalous curve E/F_p and a chosen p-adic lift, the constructed map lambda_E : E(F_p) -> F_p^+ is a group homomorphism, independent of the choice of point-lift, and is either identically zero or a group isomorphism.","For an anomalous curve and a chosen p-adic lift, the constructed map lambda_E from E(F_p) to F_p is a homomorphism independent of the point-lifting choice and is either the zero map or an isomorphism."
satoh-lambda-evaluation-complexity-005,B05,satoh-araki-1998,,formalizable,plain,(complexity: needs explicit cost model),,Evaluating lambda_E at a point requires at most about 2*log_2(p) elliptic-curve additions and has O((log p)^3) bit-complexity under the stated arithmetic model.,The explicit lambda_E evaluation requires at most about 2 log_2(p) elliptic-curve additions and has O((log p)^3) bit-complexity under the paper's arithmetic model.
satoh-nonzero-lift-construction-006,B05,satoh-araki-1998,,formalizable,plain,(unassigned),,"There exists a p-adic lift such that, under the stated coordinate condition, at least one of the two associated homomorphisms lambda_E is nonzero.","The paper constructs a nearby lift and proves that, under its coordinate condition, at least one of the two associated homomorphisms is nonzero."
satoh-zero-map-torsion-equivalence-003,B05,satoh-araki-1998,,formalizable,plain,(unassigned),,"The constructed map lambda_E is identically zero iff (equivalently) the lifted p-adic curve has a nonzero p-torsion point, among the stated equivalent conditions.","The paper proves equivalent conditions for the constructed map to be zero, including the existence of a nonzero p-torsion point in the lifted p-adic curve."
smart-group-operation-complexity-004,B05,smart-1999,,formalizable,plain,Mathlib.GroupTheory.OrderOfElement / Subgroup,,"Under the stated assumptions with known group order, computing [p]P and [p]Q each takes O(log p) group operations, yielding the linear-time (in log p) cost in basic group operations.","Under the stated assumptions and known group order, the nontrivial scalar multiplications [p]P and [p]Q require O(log p) group operations, giving the paper's linear-time characterization in basic group operations."
smart-logarithm-quotient-formula-003,B05,smart-1999,,formalizable,plain,(unassigned),,"For an anomalous curve, log_P(Q) mod p equals the quotient psi([p]Q)/psi([p]P) where psi is the p-adic elliptic logarithm of the formal group, provided psi([p]P) is a unit.",The p-adic logarithm relation yields the discrete logarithm modulo p as a quotient of the logarithms of [p]P and [p]Q.
smart-padic-lift-reduction-002,B05,smart-1999,,formalizable,plain,(unassigned),,"Lift P,Q in E(F_p) to points in E(Q_p); multiply by p to land in the formal-group neighborhood (kernel of reduction); apply the p-adic elliptic logarithm to obtain a Z_p-linear relation that determines log_P(Q) mod p.","The method lifts the input points to E(Q_p), multiplies by p to enter the formal-group neighborhood, and applies the p-adic elliptic logarithm to obtain a linear relation for the discrete logarithm."
smart-trace-one-scope-001,B05,smart-1999,,formalizable,plain,(unassigned),,#E(F_p) = p iff the trace of Frobenius a_p = 1 (since #E(F_p) = p + 1 - a_p).,"The paper studies prime-field elliptic curves with #E(F_p)=p, equivalently trace of Frobenius equal to one."
cheng-huang-shifting-prime-definition-006,B06,cheng-huang-partial-lifting-2004,problem_definition,formalizable,plain,(unassigned),,"The shifting-prime problem: given the reduction modulo p of a point P, and a second prime r, output the reduction modulo r of some rational lift of P.",The shifting prime problem asks for the reduction modulo a second prime r of any rational lift of a given point from the reduction modulo p.
hkt-theorem1-liftable-tuple-bound-005,B06,huang-kueh-tan-2000,counting_bound,formalizable,plain,Mathlib.GroupTheory.OrderOfElement / Subgroup,,"The number of r-tuples from a cyclic subgroup of F_q^* (of size N) that admit rational lifts of rank <= r and bounded height h is O(C(r,h) * N^r), an exponential-in-(r,h) factor times N^r, rather than N^{r+1}.","The number of tuples from a cyclic finite-field subgroup that admit rational lifts of bounded rank and height is bounded by a factor exponential in powers of r and h times N to the r, rather than N to the r+1."
jacobson-xedni-dependence-recovers-log-003,B06,jacobson-xedni-analysis-2000,correctness_reduction,formalizable,plain,Mathlib.GroupTheory.OrderOfElement / Subgroup,,"If lifted rational points satisfy a nontrivial integer linear relation sum c_i P_i = O whose coefficient combination is invertible modulo the subgroup order n, then this relation determines log_P(Q) modulo n.","If the lifted rational points satisfy a nontrivial integer linear relation whose corresponding coefficient combination is invertible modulo the subgroup order, the relation yields the discrete logarithm of Q to the base P."
lauter-stange-generic-eds-dlog-baselines-017,B06,lauter-stange-2008,baseline_transfer,formalizable,generic_group,(unassigned),generic_group_model,"The EDS discrete-log problem admits baby-step giant-step and Pollard-rho generic searches, so its cost retains the Theta(sqrt(n)) baseline unless additional structure is exploited.","Baby-step giant-step and Pollard-rho style generic searches apply to EDS Discrete Log, so the recurrence formulation retains square-root baselines unless additional exploitable structure is found."
lauter-stange-net-zero-linear-relation-004,B06,lauter-stange-2008,relation_encoding,formalizable,plain,(unassigned),,"For the associated net polynomials, the term indexed by (v_1,...,v_k) vanishes exactly when sum_i v_i P_i = O, outside the normalized exceptional index set.","Associated net polynomials vanish exactly when the corresponding integer linear combination of the input elliptic-curve points is the identity, outside the stated normalized exceptional indices."
lauter-stange-period-formula-007,B06,lauter-stange-2008,period_structure,formalizable,plain,Mathlib.GroupTheory.OrderOfElement / Subgroup,,The period of the unnormalized elliptic divisibility sequence equals ord(P) * (multiplicative order in the base field of the associated scaling factor).,The period of the unnormalized EDS is the point order multiplied by the multiplicative order of a scaling factor in the base field.
stange-subnet-functoriality-003,B06,stange-2011,functoriality,formalizable,plain,Mathlib.GroupTheory.OrderOfElement / Subgroup,,"Restricting an elliptic net W: A -> R to a subgroup B <= A, or precomposing W with a homomorphism of free abelian groups, again yields an elliptic net.","Restricting an elliptic net to a subgroup of its index lattice, or precomposing with a homomorphism of free abelian groups, produces another elliptic net."
stange-zero-iff-point-relation-009,B06,stange-2011,zero_relation_equivalence,formalizable,plain,(unassigned),,"For an associated nondegenerate elliptic net, the term indexed by v vanishes iff the indexed integer combination sum_i v_i P_i equals the identity O.","For an associated nondegenerate net, a term vanishes exactly when the indexed integer combination of the defining points is the identity."
glv-endomorphism-definition-003,B07,glv-2001,,formalizable,plain,Mathlib.AlgebraicGeometry.EllipticCurve.Isogeny (partial),,"An endomorphism of E is a rational map phi: E -> E with phi(O)=O. If phi is defined over the base field K, then phi is a group homomorphism on E(L) for every extension L/K.",An endomorphism of an elliptic curve is a rational self-map preserving the identity; when it is defined over the base field it acts as a group homomorphism on rational points over that field and its extensions.
glv-euclidean-basis-vector-015,B07,glv-2001,,formalizable,plain,Mathlib.GroupTheory.OrderOfElement / Subgroup,,"Applying the extended Euclidean algorithm to (n, lambda) yields a vector (a,b) in the kernel lattice { (a,b) : a + b*lambda == 0 (mod n) } with |a|,|b| = O(sqrt(n)) and Euclidean norm O(sqrt(n)).",The extended Euclidean algorithm applied to n and lambda constructs a kernel vector with components below square-root scale and Euclidean norm bounded on the order of sqrt(n).
glv-frobenius-fast-example-004,B07,glv-2001,,formalizable,plain,Mathlib.GroupTheory.OrderOfElement / Subgroup,,"The q-power Frobenius map pi_q: (x,y) |-> (x^q, y^q) is an endomorphism of E/F_q; over extension fields with a normal basis it is computable as a cyclic shift.","The Frobenius q-power map is an endomorphism and can be especially cheap over extension fields, for example becoming a cyclic shift when a normal basis is used."
glv-root-mod-n-condition-008,B07,glv-2001,,formalizable,plain,Mathlib.GroupTheory.OrderOfElement / Subgroup,,"If the characteristic polynomial of an endomorphism phi has a root lambda modulo the prime subgroup order n, then phi acts on that subgroup as the scalar multiplication map [lambda].","The method assumes that the characteristic polynomial of the endomorphism has a root lambda modulo the prime subgroup order n, so that the endomorphism acts as the scalar map [lambda] on that subgroup."
glv-subgroup-eigenvalue-006,B07,glv-2001,,formalizable,plain,Mathlib.GroupTheory.OrderOfElement / Subgroup,,"On a prime-order-n subgroup admitting an order-3 endomorphism, that endomorphism acts as [lambda] where lambda^2 + lambda + 1 == 0 (mod n).","On a prime-order subgroup, the order-three endomorphism acts as multiplication by an eigenvalue lambda satisfying lambda^2+lambda+1 congruent to zero modulo the subgroup order."
teske-prime-order-proof-003,B01,teske-2001,,formalizable_hard,plain,Mathlib.GroupTheory.OrderOfElement / Subgroup,,,"For arbitrarily large prime group orders, the paper proves that the proposed walk class can attain the random-case performance using probability results for walks in Z/pZ."
amadori-complexity-formula-003,B02,amadori-pintore-sala-2018,,formalizable_hard,plain,Mathlib.RingTheory.MvPolynomial (partial),,,"The total expected cost is modeled as p·m^m/s^m times T(E,m,V), where T is the cost of solving the final polynomial system."
amadori-prime-field-variant-001,B02,amadori-pintore-sala-2018,,formalizable_hard,plain,(unassigned),,,"The proposed prime-field variant constructs the factor base incrementally from random points R=uP+vQ, making each collected point a trivial relation instead of repeatedly solving point-decomposition systems."
amadori-relative-improvement-005,B02,amadori-pintore-sala-2018,,formalizable_hard,plain,(unassigned),T_approximately_Tprime,,"Assuming its single-system cost T is comparable to the per-system cost T' in the Petit et al. method, the proposal asymptotically improves that method for fixed m as p grows."
amadori-single-system-002,B02,amadori-pintore-sala-2018,,formalizable_hard,plain,Mathlib.RingTheory.MvPolynomial (partial),,,"A single summation-polynomial system is solved to find a dependency among the accumulated factor-base points, replacing both repeated Gröbner computations and the usual sparse linear-algebra stage."
amadori-unresolved-system-cost-007,B02,amadori-pintore-sala-2018,,formalizable_hard,plain,Mathlib.RingTheory.MvPolynomial (partial),,,"The conclusion states that the complexity of the single polynomial system is poorly understood and requires deeper analysis, including whether non-Gröbner methods are better suited."
diem2011-decomposition-algorithm-005,B02,diem-2011,,formalizable_hard,plain,(complexity: needs explicit cost model),,,The decomposition algorithm lists all isolated decompositions in expected time polynomial in e^{n^2}·log(q).
diem2011-factor-base-004,B02,diem-2011,,formalizable_hard,plain,(unassigned),,,The factor base is defined by a degree-two covering φ:E→P1 and consists of points whose image lies in P1(Fq).
diem2011-main-theorem-001,B02,diem-2011,,formalizable_hard,plain,(complexity: needs explicit cost model),,,"Diem proves an expected running-time bound e^{O(max(log q,n^2))} for ECDLP over F(q^n)."
diem2011-relation-loop-007,B02,diem-2011,,formalizable_hard,plain,(unassigned),,,"The relation-generation loop therefore needs O(q^{1/2}) decomposition attempts on average under the stated parameter conditions, and the complete algorithm is polynomially bounded in q."
diem2011-subexp-sequences-002,B02,diem-2011,,formalizable_hard,plain,(complexity: needs explicit cost model),,,"If n→∞ and n/log(q)→0, the ECDLP over F(q^n) is solvable in expected time (q^n)^{o(1)}."
diem2011-success-probability-006,B02,diem-2011,,formalizable_hard,plain,(unassigned),,,"Under (2+ε)n^2≤log2(q) and sufficiently large n, a uniformly random point has an isolated decomposition with probability at least q^{-1/2}."
diem2013-decomposition-cost-005,B02,diem-2013,,formalizable_hard,plain,(complexity: needs explicit cost model),,,"The new decomposition problem can be solved in expected time polynomial in e^{mn}·log(q), and the number of isolated decompositions of a point is at most e^{O(mn)}."
diem2013-main-theorem-001,B02,diem-2013,,formalizable_hard,plain,(complexity: needs explicit cost model),,,"Diem's strengthened theorem gives expected time e^{O(max(log q, n·sqrt(log q), n^{3/2}))} for ECDLP over F(q^n)."
diem2013-new-decomposition-004,B02,diem-2013,,formalizable_hard,plain,Mathlib.RingTheory.MvPolynomial (partial),,,The new algorithm avoids summation polynomials and projection to products of projective lines; it uses direct-sum subspaces of F(q^n) and decompositions P=P1+...+Pm with Pi drawn from distinct factor-base components.
diem2013-not-all-instances-007,B02,diem-2013,,formalizable_hard,plain,(complexity: needs explicit cost model),,,The paper explicitly states that it cannot establish the desired expected running time for all ECDLP instances.
diem2013-success-probability-006,B02,diem-2013,,formalizable_hard,plain,(unassigned),,,"Under the paper's size conditions, a uniformly random point has an isolated decomposition with probability 1/e^{O(mn)}."
diem2013-three-fourths-003,B02,diem-2013,,formalizable_hard,plain,(complexity: needs explicit cost model),,,"For extension degrees between constants times (log q)^{1/3} and log q, the paper gives expected time e^{O(log(q^n)^{3/4})}."
gaudry-abelian-index-calculus-001,B02,gaudry-2009,,formalizable_hard,plain,(unassigned),,,"Gaudry gives a general index-calculus framework for fixed-dimensional abelian varieties: choose a one-dimensional factor base, generate decompositions, collect relations, and solve sparse linear algebra."
gaudry-basic-relation-probability-004,B02,gaudry-2009,,formalizable_hard,plain,(unassigned),,,"For the dimension-one factor base and n-term decompositions, the expected number of decompositions per random target approaches 1/n! as q grows."
gaudry-decomposition-cost-003,B02,gaudry-2009,,formalizable_hard,plain,Mathlib.RingTheory.MvPolynomial (partial),,,"For a fixed family and fixed dimension, one relation can be found by a Gröbner-basis computation followed by univariate factorization in time polynomial in log(q), with exponential dependence hidden in fixed structural parameters."
gaudry-small-degree-limitation-008,B02,gaudry-2009,,formalizable_hard,plain,(unassigned),,,"The hidden constant grows rapidly with the extension degree, so the attack is presented as relevant only to small-degree extension fields."
semaev-binary-analogue-007,B02,semaev-2004,,formalizable_hard,plain,(unassigned),,,A related characteristic-two proposal replaces bounded integers by low-degree polynomials over F2 satisfying a summation-polynomial congruence.
semaev-bounded-solver-dependency-004,B02,semaev-2004,,formalizable_hard,plain,(complexity: needs explicit cost model),,,The proposed speedup is conditional on an algorithm that finds bounded solutions of explicit modular multivariate polynomial equations in polynomial or low-exponential time.
semaev-open-question-006,B02,semaev-2004,,formalizable_hard,plain,(complexity: needs explicit cost model),,,The paper explicitly leaves open whether the required bounded solutions for the proposed equations can be found in polynomial or low-exponential time.
semaev-prime-field-relation-003,B02,semaev-2004,,formalizable_hard,plain,(unassigned),,,"For E/Fp, Semaev proposes generating a random point R=l1P+l2Q and seeking bounded solutions of fn+1(x1,...,xn,x(R))=0 mod p to obtain relations among small-coordinate points and the input points."
semaev-recursion-degree-002,B02,semaev-2004,,formalizable_hard,plain,Mathlib.RingTheory.MvPolynomial (partial),,,"Summation polynomials can be constructed recursively by resultants; fn is symmetric, has degree 2^(n-2) in every variable for n≥3, and is absolutely irreducible."
survey-ffd-lfd-006,B02,galbraith-gaudry-2015,,formalizable_hard,plain,(unassigned),,,"The first-fall-degree assumption is described as potentially too optimistic; last-fall degree is more algorithm-independent and precise, but substantially harder to bound for ECDLP systems."
survey-invariants-not-competitive-003,B02,galbraith-gaudry-2015,,formalizable_hard,plain,(unassigned),,,"Even after combining large symmetry groups and invariant coordinates in the cited binary-field work, the resulting algorithms were reported as not competitive with Pollard rho."
survey-not-practical-008,B02,galbraith-gaudry-2015,,formalizable_hard,plain,(complexity: needs explicit cost model),,,"The surveyed summation-polynomial approaches were not practical at contemporary cryptographic key sizes even under optimistic assumptions, with both time and memory extremely high."
survey-scope-001,B02,galbraith-gaudry-2015,,formalizable_hard,plain,(complexity: needs explicit cost model),,,The survey distinguishes proven algorithms from complexity claims and focuses on unresolved questions surrounding summation-polynomial index calculus.
survey-symmetry-tradeoff-002,B02,galbraith-gaudry-2015,,formalizable_hard,plain,(complexity: needs explicit cost model),,,"Symmetric variables can reduce the number of solutions and sometimes polynomial degree, but after Weil descent the invariant variables may occupy much larger vector spaces when the factor-base subspace is not multiplicatively closed."
fghr-char2-limit-007,B03,fghr-2014,,formalizable_hard,plain,Mathlib.GroupTheory.OrderOfElement / Subgroup,,,The invariant-theory argument does not transfer directly to characteristic two when the field characteristic divides the acting group order; obtaining analogous results there is left open.
