claim_id,batch,source_id,claim_type,formal_status,model,mathlib_area,preconditions,formal_statement,label
fghr-construction-bottleneck-008,B03,fghr-2014,,formalizable_hard,plain,Mathlib.RingTheory.MvPolynomial (partial),,,Direct construction of high summation polynomials remains a bottleneck; the authors report practical computation only up to the sixth and ask for alternative PDP systems for extension degree at least six.
fghr-symmetry-speedup-001,B03,fghr-2014,,formalizable_hard,plain,(unassigned),,,"For twisted Edwards and twisted Jacobi-intersection representations over nonbinary extension fields, curve symmetries are used to reduce the point-decomposition problem by an exponential factor."
fhjrv-equivariance-002,B03,fhjrv-2014,,formalizable_hard,plain,Mathlib.RingTheory.MvPolynomial (partial),,,"If phi is equivariant under translation by an m-torsion point, the corresponding summation polynomial has additional invariance beyond permutation symmetry."
fhjrv-factor-base-reduction-003,B03,fhjrv-2014,,formalizable_hard,plain,Mathlib.GroupTheory.OrderOfElement / Subgroup,,,"A factor base invariant under an order-m torsion translation can be quotiented by that action, reducing its size by m and the sparse linear-algebra dimension accordingly, for an m^2 linear-algebra speedup."
fhjrv-full2torsion-004,B03,fhjrv-2014,,formalizable_hard,plain,(unassigned),,,"When inversion and full rational 2-torsion are compatible with the chosen morphism, the factor base can in favorable cases be reduced by a total factor of eight."
fhjrv-generalized-polynomials-001,B03,fhjrv-2014,,formalizable_hard,plain,Mathlib.RingTheory.MvPolynomial (partial),,,"Summation polynomials are generalized from the x-coordinate map to arbitrary morphisms phi:E→P1, allowing factor bases and relation equations adapted to torsion symmetries."
fhjrv-higher-torsion-008,B03,fhjrv-2014,,formalizable_hard,plain,Mathlib.GroupTheory.OrderOfElement / Subgroup,,,"The framework is stated to extend to higher-order torsion points, but the paper's practical focus and detailed results are primarily for 2-torsion."
fhjrv-s8-record-005,B03,fhjrv-2014,,formalizable_hard,plain,Mathlib.RingTheory.MvPolynomial (partial),,,"Using invariant variables and sparse interpolation, the authors compute the eighth symmetrized summation polynomial in about 40.5 CPU-hours, whereas direct approaches had been stopped after at least a month."
fppr2012-multihomogeneous-002,B03,faugere-perret-petit-renault-2012,,formalizable_hard,plain,(unassigned),,,"The descended systems have an affine multihomogeneous block structure, and the proposed Sub-Macaulay method generates many controlled low-degree equations before linearization."
fppr2012-pdp-reduction-001,B03,faugere-perret-petit-renault-2012,,formalizable_hard,plain,(unassigned),,,"For binary curves, the point-decomposition step is reduced to solving a multivariate equation over F(2^n) with all variables restricted to a chosen F2-vector subspace, followed by Weil descent to Boolean equations."
fppr2012-rank-assumption-003,B03,faugere-perret-petit-renault-2012,,formalizable_hard,plain,(complexity: needs explicit cost model),,,"The complexity analysis depends on Assumption 1: with probability exponentially close to one, the generated linear equations have the required rank and their linearized solutions correspond to actual solutions."
gg2014-binary-edwards-coordinate-001,B03,galbraith-gebregiyorgis-2014,,formalizable_hard,plain,(unassigned),,,"For binary Edwards curves, the coordinate t=x+y is invariant under a relatively large automorphism group and yields lower-degree summation-polynomial representations."
gg2014-pollard-comparison-007,B03,galbraith-gebregiyorgis-2014,,formalizable_hard,plain,(unassigned),,,"The paper concludes that, for practical prime-degree binary fields, summation-polynomial methods remain slower than Pollard rho, even for static-Diffie-Hellman variants requiring only one relation."
gg2014-sat-003,B03,galbraith-gebregiyorgis-2014,,formalizable_hard,plain,Mathlib.RingTheory.MvPolynomial (partial),,,"SAT solvers handled larger factor-base dimensions and often used less memory than Gröbner methods, but runtime varied strongly and no-solution instances were usually slow."
gg2014-symmetry-breaking-dreg-006,B03,galbraith-gebregiyorgis-2014,,formalizable_hard,plain,(unassigned),,,"For larger tested n, symmetry-breaking systems often had degree of regularity 3 rather than 4, though the reason was unclear."
gg2014-symmetry-dreg-004,B03,galbraith-gebregiyorgis-2014,,formalizable_hard,plain,Mathlib.RingTheory.MvPolynomial (partial),,,Greater invariant symmetry significantly reduced runtime and slightly reduced degree of regularity in the reported m=3 and m=4 Gröbner experiments.
ky2015-dreg-growth-005,B03,kosters-yeo-2015,,formalizable_hard,plain,(unassigned),,,"Experiments keep first fall degree fixed at 2 while degree of regularity rises from 3 to at least 5 as n increases to 40, with memory exceeding 38 GB."
ky2015-ffd-two-004,B03,kosters-yeo-2015,,formalizable_hard,plain,Mathlib.RingTheory.MvPolynomial (partial),,,"For the third summation-polynomial system after Weil descent, the first fall degree is usually 2, not the earlier upper bound 5."
ky2015-npcomplete-001,B03,kosters-yeo-2015,,formalizable_hard,plain,Mathlib.GroupTheory.OrderOfElement / Subgroup,,,"Under Assumption 3.3, deciding whether a high-order elliptic-curve summation polynomial evaluates to zero is NP-complete."
ky2015-semaev2015-countertest-006,B03,kosters-yeo-2015,,formalizable_hard,plain,(unassigned),,,"Repeating the Semaev-2015-style experiment at n=45,m=2,t=2 gave degree of regularity 5 and used about 126 GB, contradicting the constant-four extrapolation at that parameter."
ky2015-singular-npcomplete-002,B03,kosters-yeo-2015,,formalizable_hard,plain,Mathlib.RingTheory.MvPolynomial (partial),,,"For a fixed odd prime, the analogous evaluation problem for summation polynomials attached to a specified singular curve is unconditionally NP-complete."
ky2015-trace-morphism-003,B03,kosters-yeo-2015,,formalizable_hard,plain,(unassigned),,,"For ordinary binary elliptic curves, a trace expression in the x-coordinate defines a surjective group morphism to F2 and yields a linear relation inside the descended ideal."
ky2015-trace-speedup-008,B03,kosters-yeo-2015,,formalizable_hard,plain,Mathlib.RingTheory.MvPolynomial (partial),,,"The trace morphism can be added explicitly to the relation-generation equations or used to restrict search to its kernel, potentially speeding Gröbner computations."
mm2017-aps-correction-005,B03,mcguire-mueller-2017,,formalizable_hard,plain,Mathlib.RingTheory.MvPolynomial (partial),,,"With the APS factor-base size s=p^(1/m), the expected relation probability requires several independently generated factor bases and therefore several Gröbner-basis computations, not necessarily one."
mm2017-eval-algorithm-002,B03,mcguire-mueller-2017,,formalizable_hard,plain,Mathlib.RingTheory.MvPolynomial (partial),,,Algorithm 3.1 removes Gröbner-basis solving by enumerating candidate factor-base tuples and evaluating the summation polynomial directly.
mm2017-experiments-008,B03,mcguire-mueller-2017,,formalizable_hard,plain,Mathlib.RingTheory.MvPolynomial (partial),,,"Small-prime experiments rank Algorithm 4.1 fastest overall, show direct evaluation can outperform Gröbner methods, and report lower memory plus easy parallelism for the non-Gröbner variants."
mm2017-fast-evaluation-004,B03,mcguire-mueller-2017,,formalizable_hard,plain,Mathlib.RingTheory.MvPolynomial (partial),,,"A recursive determinant/resultant evaluation method evaluates Sm in O(log^2 p) bit operations for small fixed m, allowing evaluation of S9 and S10 without explicitly constructing those polynomials."
mm2017-random-factor-base-001,B03,mcguire-mueller-2017,,formalizable_hard,plain,(unassigned),,,"The prime-field algorithms use a random, target-dependent factor base consisting of points aiP+biQ; rerunning the algorithm changes the factor base."
mm2017-sum-algorithm-003,B03,mcguire-mueller-2017,,formalizable_hard,plain,Mathlib.RingTheory.MvPolynomial (partial),,,"Algorithm 4.1 avoids summation polynomials, Gröbner bases, and linear algebra by summing m-1 factor-base points and testing whether the resulting point lies in the factor base."
pq2012-ffd-assumption-003,B03,petit-quisquater-2012,,formalizable_hard,plain,Mathlib.GroupTheory.OrderOfElement / Subgroup,dreg_near_ffd,,"Assumption 1 states that, except for a negligible fraction of systems, degree of regularity equals first fall degree plus a lower-order term."
pq2012-ffd-bound-002,B03,petit-quisquater-2012,,formalizable_hard,plain,(unassigned),,,"For the considered Weil-descent system, the first fall degree is at most m*t+1."
semaev2015-assumption1-003,B03,semaev-2015,,formalizable_hard,plain,Mathlib.RingTheory.MvPolynomial (partial),,,Assumption 1 states that the maximum F4 step degree is at most 4 for the split Boolean systems with the stated factor-base dimension.
semaev2015-cubic-system-002,B03,semaev-2015,,formalizable_hard,plain,(unassigned),,,"After Weil descent in characteristic two, the split formulation produces cubic Boolean systems rather than the much higher-degree direct summation equation."
semaev2015-experiments-004,B03,semaev-2015,,formalizable_hard,plain,Mathlib.RingTheory.MvPolynomial (partial),,,"In 2300 tested systems over small parameter ranges, F4 reached degree at most 4 before the basis was obtained, supporting Assumption 1 within the tested range."
semaev2015-k-greater-limit-008,B03,semaev-2015,,formalizable_hard,plain,(unassigned),,,"The paper reports that degree of regularity generally exceeds 4 when the factor-base dimension k is increased beyond ceil(n/m), even though first fall degree remains 4."
semaev2015-splitting-001,B03,semaev-2015,,formalizable_hard,plain,(unassigned),,,The proposed algorithm replaces one high-degree summation-polynomial equation with a chain of third summation-polynomial equations using intermediate variables.
st2013-delta-condition-003,B03,shantz-teske-2013,,formalizable_hard,plain,Mathlib.RingTheory.MvPolynomial (partial),,,"Reducing n' by one costs a factor 2^m in decomposition probability and a factor 2 in the number of required relations, so the Gröbner computation must improve by more than 2^(m-1) for the Delta step to be beneficial."
st2013-delta-method-002,B03,shantz-teske-2013,,formalizable_hard,plain,Mathlib.RingTheory.MvPolynomial (partial),,,"The Delta method deliberately chooses factor-base dimension n' below n/m, sacrificing relation probability but often reducing Gröbner-basis time and memory dramatically."
st2013-hybrid-results-004,B03,shantz-teske-2013,,formalizable_hard,plain,(unassigned),,,"For the tested range, standard hybrid variable fixing outperformed block-hybrid fixing, and combining hybrid with Delta gave no significant improvement over Delta alone."
st2013-pairslimit-007,B03,shantz-teske-2013,,formalizable_hard,plain,Mathlib.RingTheory.MvPolynomial (partial),,,"Magma's PairsLimit parameter can reduce memory and runtime for difficult F4 computations, but no formula is known for selecting its optimum value."
st2013-replication-001,B03,shantz-teske-2013,,formalizable_hard,plain,(unassigned),,,"The study reproduces and extends Petit-Quisquater degree-of-regularity experiments from n=11,17 up to n=29 and generally observes degrees below the assumed m^2+1 bound."
st2013-subfield-basis-005,B03,shantz-teske-2013,,formalizable_hard,plain,(unassigned),,,"For even n and m=2, choosing a subfield-based factor-base basis produced extremely large practical speedups and degree of regularity 3 for every tested solvable system."
st2013-subfield-speedup-006,B03,shantz-teske-2013,,formalizable_hard,plain,Mathlib.RingTheory.MvPolynomial (partial),,,At n=40 the reported Gröbner time fell from roughly 375-388 seconds with the standard basis to 0.02-0.08 seconds with a subfield basis.
st2013-unknown-complexity-008,B03,shantz-teske-2013,,formalizable_hard,plain,Mathlib.RingTheory.MvPolynomial (partial),,,The paper concludes that the true complexity of the Semaev/Weil-descent/Gröbner index-calculus method remains undetermined.
f4-compression-memory-011,B04,faugere-f4-1999,,formalizable_hard,plain,(unassigned),,,"Matrix compression choices trade CPU cost against memory use; the paper discusses no compression, bitmap compression, and index-based representations for sparse rows."
f4-correctness-007,B04,faugere-f4-1999,,formalizable_hard,plain,Mathlib.RingTheory.MvPolynomial (partial),,,The paper proves termination and that the stated F4 algorithm returns a Groebner basis generating the same ideal as the input.
f4-drl-design-004,B04,faugere-f4-1999,,formalizable_hard,plain,Mathlib.GroupTheory.OrderOfElement / Subgroup,,,"F4 is designed to be efficient for degree-reverse-lexicographic ordering, while efficient conversion to a lexicographic basis is delegated to another algorithm."
f4-full-solving-pipeline-003,B04,faugere-f4-1999,,formalizable_hard,plain,Mathlib.GroupTheory.OrderOfElement / Subgroup,,,"Computing a Groebner basis is only one stage of a full polynomial-solving process; change of ordering, triangular decomposition, and root extraction can remain necessary afterward."
f4-minimum-degree-selection-008,B04,faugere-f4-1999,,formalizable_hard,plain,(unassigned),,,"The selection strategy is described as crucial for performance, and selecting critical pairs of minimal degree is presented as a practical strategy for controlling matrix construction."
f4-no-worst-case-improvement-002,B04,faugere-f4-1999,,formalizable_hard,plain,Mathlib.RingTheory.MvPolynomial (partial),,,"The F4 paper explicitly states that the algorithm does not improve the worst-case complexity of Groebner-basis computation, despite being several times faster than earlier implementations on reported examples."
f4-open-optimization-014,B04,faugere-f4-1999,,formalizable_hard,plain,(unassigned),,,"The paper identifies open optimization directions in linear algebra, matrix compression, selection strategies, multihomogeneous weights, and exploitation of symmetries."
f4-output-size-bottleneck-013,B04,faugere-f4-1999,,formalizable_hard,plain,Mathlib.RingTheory.MvPolynomial (partial),,,A reported integer-coefficient computation required about 18 days and produced roughly 1660 MB of output containing 1344 large polynomials; the paper notes that the output was too large to use and interprets this as approaching intrinsic Groebner-basis complexity.
f4-small-example-warning-009,B04,faugere-f4-1999,,formalizable_hard,plain,Mathlib.RingTheory.MvPolynomial (partial),small-benchmark-extrapolation,,The paper warns that the efficiency of F4 cannot be fully appreciated from small examples.
f4-strategy-sequentiality-005,B04,faugere-f4-1999,,formalizable_hard,plain,(unassigned),,,"Critical-pair and reductor selection strategies materially affect performance, and common sugar-style strategies impose sequential dependencies that hinder massive parallelization."
f5-correctness-termination-009,B04,faugere-f5-2002,,formalizable_hard,plain,(unassigned),regular-sequence,,"The paper proves correctness up to degree d and gives a termination argument under homogeneous input and no reduction to zero, while noting that a modification can ensure termination more generally."
f5-incremental-homogeneous-006,B04,faugere-f5-2002,,formalizable_hard,plain,Mathlib.RingTheory.MvPolynomial (partial),,,The main F5 algorithm is incremental: it processes a list of homogeneous polynomials and constructs Groebner bases for nested ideals one input polynomial at a time.
f5-normalized-pair-criterion-005,B04,faugere-f5-2002,,formalizable_hard,plain,Mathlib.RingTheory.MvPolynomial (partial),,,"The F5 correctness criterion is expressed using admissible signed polynomials, normalized critical pairs, and signature-compatible reductions."
f5-overconstrained-warning-012,B04,faugere-f5-2002,,formalizable_hard,plain,Mathlib.RingTheory.MvPolynomial (partial),regular-sequence,,The paper states that F5 is not always faster than F4 and expects poor performance on overconstrained systems; the largest benefits are expected when the number of equations does not exceed the number of variables.
f5-reducer-four-conditions-008,B04,faugere-f5-2002,,formalizable_hard,plain,(unassigned),,,"The IsReducible step requires ordinary leading-term divisibility, satisfaction of the new normalization criterion, absence of an applicable rewrite rule, and avoidance of an identical matrix row."
f5-regular-sequence-zero-002,B04,faugere-f5-2002,,formalizable_hard,plain,(unassigned),regular-sequence;regular-sequence,,"The paper proves that a regular-sequence input produces no reduction to zero, while repeated or structurally dependent equations can still create reductions to zero in non-regular cases."
f5-signature-criterion-001,B04,faugere-f5-2002,,formalizable_hard,plain,Mathlib.RingTheory.MvPolynomial (partial),regular-sequence,,"F5 augments polynomials with signatures and proposes a criterion that eliminates useless critical pairs; for a regular-sequence input, the paper states that no useless critical pairs are generated."
f5-signature-reuse-004,B04,faugere-f5-2002,,formalizable_hard,plain,(unassigned),,,Signatures assign a unique provenance to generated polynomials and allow the algorithm to recognize and reuse computations already performed at lower degrees.
f5-zero-reduction-syzygy-010,B04,faugere-f5-2002,,formalizable_hard,plain,Mathlib.RingTheory.MvPolynomial (partial),,,"When F5 encounters a reduction to zero, the paper links its signature to a syzygy not generated by the principal syzygies used by the criterion."
galbraith-gaudry-zero-dimensional-002,B04,galbraith-mpkc-2012,,formalizable_hard,generic_group,Mathlib.RingTheory.MvPolynomial (partial),zero-dimensionality;generic_group_model,,"Gaudry assumes the descended algebraic set is generically zero-dimensional, after which rational solutions can be obtained by a Groebner basis followed by roots of univariate polynomials."
galbraith-summation-solving-bottleneck-001,B04,galbraith-mpkc-2012,,formalizable_hard,plain,(unassigned),,,"For prime-field Semaev decomposition, all index-calculus ingredients are available except efficient factor-base decomposition; the book notes that no efficient method was known for the bounded summation-polynomial equation even at n = 5."
galbraith-three-variable-heuristic-006,B04,galbraith-mpkc-2012,,formalizable_hard,plain,(unassigned),algebraic-independence;algebraic-independence,,"For integer polynomials in three or more variables, known small-root methods may produce several polynomials sharing the root, but there is no general guarantee that these polynomials are algebraically independent."
ghs-hyperelliptic-index-two-phase-007,B05,ghs-2002,,formalizable_hard,plain,(unassigned),,,The attack stage uses hyperelliptic index calculus with relation collection over a factor base followed by sparse linear algebra.
satoh-explicit-mod-p2-evaluation-004,B05,satoh-araki-1998,,formalizable_hard,quantum,Mathlib.AlgebraicGeometry.EllipticCurve,,,"For a short Weierstrass anomalous curve, Corollary 3.6 gives an explicit procedure over Z/p^2Z to evaluate lambda_E using a lifted point and the multiple (p-1)A."
cheng-huang-corollary-short-lift-program-014,B06,cheng-huang-partial-lifting-2004,existence_result,formalizable_hard,plain,(unassigned),,,"If a finite-field point is liftable in the specified setting, at least one rational lift has projective coordinates with a straight-line program of polylogarithmic length in the input parameters."
cheng-huang-height-decision-definition-003,B06,cheng-huang-partial-lifting-2004,problem_definition,formalizable_hard,plain,(unassigned),,,The height decision problem asks whether a finite-field point has any rational lift on the chosen rational curve whose naive height is at most a supplied bound.
cheng-huang-large-coordinates-short-slp-012,B06,cheng-huang-partial-lifting-2004,representation_compression,formalizable_hard,quantum,(not in Mathlib: quantum circuit cost model),,,"Although a minimal-height rational lift may have coordinates requiring exponentially many bits when expanded, scalar multiplication can give those coordinates a short straight-line description."
cheng-huang-partial-lifting-program-001,B06,cheng-huang-partial-lifting-2004,reduction_program,formalizable_hard,plain,(unassigned),,,The paper replaces explicit rational point lifting with three partial-information problems and reduces ECDLP to each of them under stated rank-distribution assumptions.
cheng-huang-proposition1-polylog-slp-013,B06,cheng-huang-partial-lifting-2004,straight_line_complexity,formalizable_hard,plain,(unassigned),,,The properly reduced projective coordinates of a scalar multiple mP admit a straight-line program whose length is polynomial in the logarithms of the curve coefficients and m.
cheng-huang-slp-definition-008,B06,cheng-huang-partial-lifting-2004,problem_definition,formalizable_hard,plain,(unassigned),,,The straight-line description problem asks for polynomial-length straight-line programs representing projective coordinates of any rational lift of the finite-field point.
hkt-asymptotic-lower-range-open-012,B06,huang-kueh-tan-2000,scope_boundary,formalizable_hard,plain,(unassigned),,,The paper explicitly states that its asymptotic analysis leaves open the possibility that lifting or xedni techniques could behave differently for lower finite-field sizes.
hkt-construction-independent-bound-008,B06,huang-kueh-tan-2000,method_independence,formalizable_hard,plain,(unassigned),,,"The tuple-count obstruction is formulated independently of the particular procedure used to construct the rational curve and its lifts, provided the resulting objects satisfy the stated rank and height bounds."
hkt-lifting-two-obstacles-001,B06,huang-kueh-tan-2000,bottleneck_decomposition,formalizable_hard,plain,(unassigned),,,A lifting-based index-calculus approach to ECDLP faces two distinct obstacles: constructing a rational lift of sufficiently large rank and lifting finite-field points to rational points of reasonably bounded height.
hkt-no-direct-secp-attack-013,B06,huang-kueh-tan-2000,scope_boundary,formalizable_hard,plain,(unassigned),,,The paper derives necessary conditions and obstructions for lifting-based attacks; it does not provide an algorithm that solves random single-target ECDLP on a prime-field curve.
hkt-proposition1-relation-coefficient-bound-004,B06,huang-kueh-tan-2000,height_relation_bound,formalizable_hard,plain,(unassigned),,,"For a rational elliptic curve of rank at most r, any r+1 rational points of canonical height at most h satisfy a nontrivial integer relation with coefficients bounded in terms of r and h divided by the logarithm of the minimal discriminant."
hkt-xedni-fixed-r-fails-asymptotically-009,B06,huang-kueh-tan-2000,attack_lower_bound,formalizable_hard,plain,(unassigned),,,A xedni-style method that lifts only a fixed bounded number of random points has asymptotically negligible success probability under the paper's assumptions.
jacobson-xedni-constant-relation-bound-007,B06,jacobson-xedni-analysis-2000,height_relation_bound,formalizable_hard,plain,(unassigned),,,"For a dependent lifted tuple satisfying the stated height and discriminant conditions, there is a nonzero integer relation whose coefficients are bounded by an absolute constant independent of p."
jacobson-xedni-empirical-implementation-009,B06,jacobson-xedni-analysis-2000,reproduction_record,formalizable_hard,plain,(unassigned),,,The authors implemented the xedni experiments using LiDIA and SIMATH and measured dependence behavior on generated rational lifts.
jacobson-xedni-lift-curve-fit-001,B06,jacobson-xedni-analysis-2000,algorithm_description,formalizable_hard,plain,(unassigned),,,The xedni construction lifts several finite-field points to rational points and then constructs an elliptic curve over the rationals passing through those lifts while reducing to the original curve modulo p.
jacobson-xedni-linear-runtime-lower-bound-008,B06,jacobson-xedni-analysis-2000,end_to_end_complexity,formalizable_hard,plain,Mathlib.GroupTheory.OrderOfElement / Subgroup,,,Combining the bounded relation coefficients with the probability count gives an asymptotic requirement of order p trials for the analyzed xedni attack.
jacobson-xedni-practical-negative-result-012,B06,jacobson-xedni-analysis-2000,attack_assessment,formalizable_hard,plain,(unassigned),,,The numerical experiments and asymptotic analysis jointly support the conclusion that the analyzed xedni calculus is impractical for cryptographic-size prime fields.
jacobson-xedni-random-combinations-002,B06,jacobson-xedni-analysis-2000,input_transformation,formalizable_hard,plain,(unassigned),,,"The attack begins with a bounded number of random linear combinations of the input points P and Q, most plausibly four to six in the parameter discussion, and attempts to lift those combinations."
jacobson-xedni-reverse-mestre-correlation-011,B06,jacobson-xedni-analysis-2000,heuristic_evaluation,formalizable_hard,plain,(unassigned),,,"Reverse-Mestre local conditions occurred more frequently among dependent samples in some experiments, but the measured effect was far too small to overcome the low absolute dependence probability."
jacobson-xedni-scope-not-all-lifting-013,B06,jacobson-xedni-analysis-2000,scope_boundary,formalizable_hard,plain,(unassigned),,,The paper's negative conclusion is directed at the xedni construction based on a bounded collection of rational lifts and does not constitute a theorem that every possible lifting-based ECDLP method must fail.
